{
  "id": "guard_spear",
  "name": "Guard Spear",
  "itemType": "weapon",
  "equipmentSlot": "weapon",
  "stackSize": 1,
  "weaponId": "spear",
  "rarity": "magic",
  "description": "A long spear suited for disciplined guards.",
  "value": 35,
  "unlock": { "flag": "guard_spear" },
  "stats": { "damagePercent": 5 }
}
