{
  "id": "sage_staff",
  "name": "Sage Staff",
  "itemType": "weapon",
  "stackSize": 1,
  "rarity": "rare",
  "description": "A focus for channelled force, as much blunt instrument as wand.",
  "value": 20,
  "stats": {
    "physicalDamage": 18
  },
  "ruleText": "Each kill restores 10 mana.",
  "rules": [
    {
      "event": "onKill",
      "effect": "restore_mana",
      "amount": 10.0
    }
  ],
  "equipmentSlot": "weapon",
  "weaponId": "staff"
}
