{
    "id":  "frost_knight_helm",
    "name":  "Frost Knight Helm",
    "itemType":  "armor",
    "stackSize":  1,
    "rarity":  "rare",
    "description":  "A helm sealed in rime; breath fogs inside like a tomb.",
    "value":  20,
    "stats":  {
                  "maxHealth":  15,
                  "defense":  8
              },
    "equipmentSlot":  "helmet",
    "theme":  "frozen_fortress"
}
