{
  "id": "unique_choirless_helm",
  "name": "Choirless Helm",
  "itemType": "armor",
  "equipmentSlot": "helmet",
  "stackSize": 1,
  "rarity": "rare",
  "description": "Lined to muffle sound. The wearer had already heard the choir once.",
  "value": 280,
  "lootValue": 140,
  "unique": true,
  "baseId": "helm",
  "biome": "dark_cathedral",
  "scaling": {
    "strength": "D"
  },
  "ruleText": "Clearing a room restores 30 mana.",
  "rules": [
    {
      "event": "onRoomClear",
      "effect": "restore_mana",
      "amount": 30.0
    }
  ],
  "stats": {
    "armor": 7,
    "manaMax": 20,
    "resistArcane": 0.08
  }
}
