{
  "id": "iron_sword",
  "name": "Iron Sword",
  "itemType": "weapon",
  "stackSize": 1,
  "rarity": "common",
  "description": "A serviceable blade for those who cannot afford castle steel.",
  "value": 20,
  "stats": {
    "physicalDamage": 10
  },
  "equipmentSlot": "weapon",
  "weaponId": "sword_basic"
}
