{
  "id": "training_greatsword",
  "name": "Training Greatsword",
  "itemType": "weapon",
  "equipmentSlot": "weapon",
  "stackSize": 1,
  "weaponId": "greatsword",
  "rarity": "common",
  "description": "A heavy greatsword for learning wide swings.",
  "value": 30,
  "stats": { "damagePercent": 4 }
}
