{
  "id": "frost_glacier_sword",
  "name": "Frost Glacier Sword",
  "itemType": "weapon",
  "stackSize": 1,
  "rarity": "epic",
  "description": "Ice crystals creep along the edge; each swing leaves a chill.",
  "value": 20,
  "stats": {
    "physicalDamage": 38
  },
  "equipmentSlot": "weapon",
  "theme": "frozen_fortress",
  "weaponId": "castle_sword"
}
