{
  "id": "graysteel_longsword",
  "name": "Graysteel Longsword",
  "itemType": "weapon",
  "equipmentSlot": "weapon",
  "stackSize": 1,
  "rarity": "common",
  "description": "Long enough to keep a stranger honest. Vault-stock, stamped and stacked for a war that was called off. Scaling: Strength C, Dexterity C.",
  "value": 61,
  "lootValue": 30,
  "baseId": "longsword",
  "materialTier": "graysteel",
  "biome": "iron_vault",
  "scaling": {
    "strength": "C",
    "dexterity": "C"
  },
  "stats": {
    "physicalDamage": 7,
    "resistPhysical": 0.02
  },
  "weaponId": "sword_basic"
}
