{
  "id": "caltrops",
  "name": "Caltrops",
  "itemType": "consumable",
  "stackSize": 8,
  "rarity": "common",
  "description": "Scattered behind you, and remembered too late by whoever follows.",
  "consumableEffect": {
    "kind": "throw",
    "statusId": "bleed",
    "duration": 8,
    "radius": 3.5,
    "usableInHub": false
  },
  "value": 40,
  "lootValue": 20
}
